[
  {
    "hs8": "84820010",
    "hs6": "848200",
    "chapter": 84,
    "heading": "8482",
    "designation_fr": "Roulements à billes, à contact radial",
    "designation_de": "Kugellager, mit radialer Berührung",
    "designation_it": "Cuscinetti a sfere a contatto radiale",
    "designation_en": "Ball bearings with radial contact",
    "unit_stat": "par 100 kg brut",
    "duty_mfn_value": 0,
    "duty_mfn_unit": "par 100 kg brut",
    "duty_mfn_currency": "CHF",
    "preferential_regimes": { "eu": "free", "efta": "free", "uk": "free" },
    "restrictions_codes": [],
    "valid_from": "2025-01-01",
    "source_url": "https://xtares.admin.ch/tares/control/searchSimpleTarifNumber?number=84820010"
  },
  {
    "hs8": "39031100",
    "hs6": "390311",
    "chapter": 39,
    "heading": "3903",
    "designation_fr": "Polystyrène expansible, sous formes primaires",
    "designation_de": "Polystyrol, expandierbar, in Primärformen",
    "designation_it": "Polistirene espansibile, in forme primarie",
    "designation_en": "Expandable polystyrene, in primary forms",
    "unit_stat": "par 100 kg brut",
    "duty_mfn_value": 8.5,
    "duty_mfn_unit": "par 100 kg brut",
    "duty_mfn_currency": "CHF",
    "preferential_regimes": { "eu": "free", "efta": "free" },
    "restrictions_codes": [],
    "valid_from": "2025-01-01",
    "source_url": "https://xtares.admin.ch/tares/control/searchSimpleTarifNumber?number=39031100"
  },
  {
    "hs8": "22030001",
    "hs6": "220300",
    "chapter": 22,
    "heading": "2203",
    "designation_fr": "Bières en bouteilles",
    "designation_de": "Bier in Flaschen",
    "designation_it": "Birra in bottiglie",
    "designation_en": "Beer in bottles",
    "unit_stat": "par hl",
    "duty_mfn_value": 24.75,
    "duty_mfn_unit": "par hl",
    "duty_mfn_currency": "CHF",
    "preferential_regimes": { "eu": 12.4, "efta": "free" },
    "restrictions_codes": [],
    "valid_from": "2025-01-01",
    "source_url": "https://xtares.admin.ch/tares/control/searchSimpleTarifNumber?number=22030001"
  },
  {
    "hs8": "64041100",
    "hs6": "640411",
    "chapter": 64,
    "heading": "6404",
    "designation_fr": "Chaussures de sport à semelles extérieures en caoutchouc ou plastique",
    "designation_de": "Sportschuhe mit Laufsohlen aus Kautschuk oder Kunststoff",
    "designation_it": "Calzature sportive con suole in gomma o plastica",
    "designation_en": "Sports footwear with rubber or plastic outer soles",
    "unit_stat": "par 1 paire",
    "duty_mfn_value": 0.58,
    "duty_mfn_unit": "par 1 paire",
    "duty_mfn_currency": "CHF",
    "preferential_regimes": { "eu": "free", "efta": "free", "cn": 0.377 },
    "restrictions_codes": [],
    "valid_from": "2025-01-01",
    "source_url": "https://xtares.admin.ch/tares/control/searchSimpleTarifNumber?number=64041100"
  },
  {
    "hs8": "90181300",
    "hs6": "901813",
    "chapter": 90,
    "heading": "9018",
    "designation_fr": "Appareils de résonance magnétique (IRM)",
    "designation_de": "Kernspintomographen (MRT)",
    "designation_it": "Apparecchi di risonanza magnetica (RMN)",
    "designation_en": "Magnetic resonance imaging apparatus (MRI)",
    "unit_stat": "par 1 pièce(s)",
    "duty_mfn_value": 0,
    "duty_mfn_unit": "par 1 pièce(s)",
    "duty_mfn_currency": "CHF",
    "preferential_regimes": { "eu": "free", "efta": "free" },
    "restrictions_codes": [],
    "valid_from": "2025-01-01",
    "source_url": "https://xtares.admin.ch/tares/control/searchSimpleTarifNumber?number=90181300"
  }
]
